{
  "manifest_version": "1.0.0",
  "cli": {
    "name": "fbcli",
    "version": "0.1.0"
  },
  "stability": {
    "contract": "stable",
    "compatibility_policy": [
      "Breaking discovery contract changes require manifest_version major bump.",
      "Within same major version, only additive fields are allowed.",
      "Published command ids are stable and must not be renamed without major bump."
    ]
  },
  "environment": {
    "required": [],
    "optional": [
      {
        "name": "FBCLI_ACCESS_TOKEN",
        "description": "Meta access token used for Graph API GET requests. Overrides stored auth token."
      },
      {
        "name": "FBCLI_API_VERSION",
        "description": "Graph API version prefix used for requests.",
        "default": "v25.0"
      },
      {
        "name": "FB_APP_ID",
        "description": "Facebook app id used by fbcli auth login."
      },
      {
        "name": "FB_APP_SECRET",
        "description": "Facebook app secret used by fbcli auth login."
      },
      {
        "name": "FB_REDIRECT_URI",
        "description": "OAuth redirect URI used by fbcli auth login.",
        "default": "http://localhost:53682/auth/facebook/callback"
      },
      {
        "name": "FBCLI_AUTH_FILE",
        "description": "Optional override for local stored auth token path."
      }
    ]
  },
  "errors": [
    {
      "code": "INVALID_NODE_TYPE",
      "description": "A provided node type is not supported by fbcli.",
      "likely_cause": "Typo in --node-type or unsupported resource type.",
      "suggested_fix": "Run fbcli nodes list or help --json and use a supported node type."
    },
    {
      "code": "INVALID_GRAPH_ID",
      "description": "A Graph ID failed fbcli normalization or format checks.",
      "likely_cause": "Malformed ID (extra slashes, wrong prefix, empty value).",
      "suggested_fix": "Use a valid Graph ID (for ad accounts, prefix with act_)."
    },
    {
      "code": "AMBIGUOUS_GRAPH_ID",
      "description": "A numeric Graph ID could map to multiple node types.",
      "likely_cause": "Using raw numeric IDs without --node-type hint.",
      "suggested_fix": "Pass --node-type explicitly when using numeric IDs."
    },
    {
      "code": "EDGE_NOT_SUPPORTED",
      "description": "Requested edge is not supported for the resolved node type.",
      "likely_cause": "Incompatible node + edge combination.",
      "suggested_fix": "Run fbcli edges list --node <type> and pick a supported edge."
    },
    {
      "code": "UNSUPPORTED_IN_MVP",
      "description": "Operation exists in Graph API but is blocked by read-only MVP guardrails.",
      "likely_cause": "Write operation or non-MVP edge usage.",
      "suggested_fix": "Use GET-only commands within MVP-supported edges."
    },
    {
      "code": "MISSING_TOKEN",
      "description": "No access token was provided for Meta API calls.",
      "likely_cause": "FBCLI_ACCESS_TOKEN env var not set.",
      "suggested_fix": "Export FBCLI_ACCESS_TOKEN before running API commands."
    },
    {
      "code": "MISSING_APP_CREDENTIALS",
      "description": "OAuth login command did not receive required app credentials.",
      "likely_cause": "FB_APP_ID/FB_APP_SECRET are missing and no --app-id/--app-secret flags were passed.",
      "suggested_fix": "Set FB_APP_ID and FB_APP_SECRET, or pass both flags to fbcli auth login."
    },
    {
      "code": "AUTH_CALLBACK_LISTENER_ERROR",
      "description": "Local OAuth callback listener could not start or process callback data.",
      "likely_cause": "Invalid redirect URI, occupied callback port, denied OAuth grant, or callback host mismatch.",
      "suggested_fix": "Use localhost redirect URI, free the callback port, then retry auth login."
    },
    {
      "code": "AUTH_CALLBACK_TIMEOUT",
      "description": "OAuth callback was not received before timeout.",
      "likely_cause": "Browser sign-in was not completed or redirect URI did not return to local callback.",
      "suggested_fix": "Complete Facebook sign-in promptly or increase --timeout-seconds."
    },
    {
      "code": "AUTH_STATE_MISMATCH",
      "description": "OAuth state in callback did not match the generated state.",
      "likely_cause": "Interrupted flow or unexpected callback URL tampering.",
      "suggested_fix": "Retry login from a fresh auth command and avoid reusing stale callback URLs."
    },
    {
      "code": "AUTH_TOKEN_EXCHANGE_FAILED",
      "description": "Authorization code exchange failed at Meta OAuth endpoint.",
      "likely_cause": "Expired code, invalid app secret, wrong redirect_uri, or API-side OAuth error.",
      "suggested_fix": "Verify FB_APP_ID/FB_APP_SECRET/redirect URI alignment and run login again."
    },
    {
      "code": "AUTH_STORAGE_ERROR",
      "description": "fbcli could not read or write local auth token storage.",
      "likely_cause": "Filesystem permission issues or corrupted token file.",
      "suggested_fix": "Fix file permissions and retry auth login/logout."
    },
    {
      "code": "META_API_ERROR",
      "description": "Meta Graph API returned an error or upstream failure occurred.",
      "likely_cause": "Permission issues, invalid params, expired token, or API-side failure.",
      "suggested_fix": "Inspect error.details and validate token scopes, IDs, and parameters."
    }
  ],
  "commands": [
    {
      "id": "help.json",
      "path": [
        "help",
        "--json"
      ],
      "summary": "Machine-readable discovery manifest for AI agents.",
      "options": [
        {
          "name": "--json",
          "aliases": [],
          "type": "boolean",
          "required": false,
          "default": false,
          "description": "Return the machine-readable manifest instead of human help text."
        },
        {
          "name": "--command-id",
          "aliases": [],
          "type": "string",
          "required": false,
          "value_hint": "<id>",
          "description": "Return one command descriptor by stable command id."
        },
        {
          "name": "--recipe-id",
          "aliases": [],
          "type": "string",
          "required": false,
          "value_hint": "<id>",
          "description": "Return one recipe descriptor by stable recipe id."
        },
        {
          "name": "--errors-only",
          "aliases": [],
          "type": "boolean",
          "required": false,
          "default": false,
          "description": "Return only the error catalog section."
        }
      ],
      "arguments": [],
      "output_contract": {
        "top_level_keys": [
          "manifest_version",
          "cli",
          "stability",
          "environment",
          "errors",
          "commands",
          "recipes"
        ],
        "key_notes": {
          "manifest_version": "Versioned discovery contract. Major changes indicate breaking schema changes.",
          "commands": "Stable command descriptors for agent planning/execution.",
          "recipes": "Generic runnable templates with placeholders."
        },
        "conditional_notes": [
          "With --command-id, output is { manifest_version, command }.",
          "With --recipe-id, output is { manifest_version, recipe }.",
          "With --errors-only, output is { manifest_version, errors }."
        ]
      },
      "examples": [
        {
          "title": "Full manifest",
          "command": "fbcli help --json"
        },
        {
          "title": "Single command",
          "command": "fbcli help --json --command-id report.creative-deep-dive"
        },
        {
          "title": "Error catalog",
          "command": "fbcli help --json --errors-only"
        }
      ]
    },
    {
      "id": "auth.login",
      "path": [
        "auth",
        "login"
      ],
      "summary": "Run localhost OAuth login and persist access token for fbcli.",
      "options": [
        {
          "name": "--app-id",
          "aliases": [],
          "type": "string",
          "required": false,
          "value_hint": "<id>",
          "description": "Facebook app id (falls back to FB_APP_ID)."
        },
        {
          "name": "--app-secret",
          "aliases": [],
          "type": "string",
          "required": false,
          "value_hint": "<secret>",
          "description": "Facebook app secret (falls back to FB_APP_SECRET)."
        },
        {
          "name": "--redirect-uri",
          "aliases": [],
          "type": "string",
          "required": false,
          "default": "http://localhost:53682/auth/facebook/callback",
          "value_hint": "<uri>",
          "description": "OAuth callback URI for local listener."
        },
        {
          "name": "--scopes",
          "aliases": [],
          "type": "csv",
          "required": false,
          "default": "ads_read,ads_management,business_management,pages_show_list,pages_read_engagement,pages_manage_ads,public_profile",
          "value_hint": "<csv>",
          "description": "Comma-separated scope list to request."
        },
        {
          "name": "--api-version",
          "aliases": [],
          "type": "string",
          "required": false,
          "default": "v25.0",
          "value_hint": "<version>",
          "description": "Graph API version for OAuth/token exchange."
        },
        {
          "name": "--timeout-seconds",
          "aliases": [],
          "type": "number",
          "required": false,
          "default": 180,
          "value_hint": "<n>",
          "description": "Maximum wait time for OAuth callback."
        },
        {
          "name": "--no-open",
          "aliases": [],
          "type": "boolean",
          "required": false,
          "default": false,
          "description": "Disable auto-opening browser and print URL only."
        },
        {
          "name": "--no-rerequest",
          "aliases": [],
          "type": "boolean",
          "required": false,